{
  "boType": "METERING_TIME_DEFINITION",
  "structureVersion": "1",
  "beginDate": "1921-04-26T15:25:04.0Z",
  "closingDate": "1904-01-25T15:14:42.0Z",
  "version": "1896-09-06T21:55:07.0Z",
  "necessity": "DEFINITIONS_USED",
  "versionSpecification": "VERSION_000000",
  "code": "CODE_010111",
  "meteringTimes": [
    {
      "code": "CODE_101010",
      "frequency": "ANNUAL",
      "transmissibility": "NON_ELECTRONIC",
      "peakLoadDetermination": "USE_OF_PEAK_LOAD_WINDOW",
      "isOrderable": true,
      "typeValue": "OFF_PEAK_TIME_WINDOW",
      "descriptionType": "dolore in mollit",
      "changeTimestamp": "1931-07-11T21:13:23.0Z",
      "register": "ad laborum cupidatat ullamco veniam"
    }
  ],
  "meteringTimeRegister": [
    {
      "register": "deserunt enim",
      "meteringTimeDefinition": "magna aute consectetur",
      "offPeakCapable": "NOT_OFF_PEAK_CAPABLE"
    }
  ]
}